[
  {
    "sku": "LBR-D0414F1E",
    "type": "simple",
    "name": "ToughGrip 2x4 Stud - 8ft",
    "status": "enabled",
    "visibility": "both",
    "price": 9.219257355304089,
    "attributes": [
      {
        "code": "product_category",
        "value": "structural_materials"
      },
      {
        "code": "brand",
        "value": "toughgrip"
      },
      {
        "code": "unit_of_measure",
        "value": "EA"
      },
      {
        "code": "project_types",
        "value": [
          "new_construction",
          "remodel"
        ]
      },
      {
        "code": "ppe_cut_resistance",
        "value": "a7"
      },
      {
        "code": "ppe_hard_hat_class",
        "value": "class_c"
      },
      {
        "code": "construction_phase",
        "value": [
          "foundation_framing"
        ]
      },
      {
        "code": "quality_tier",
        "value": "builder_grade"
      },
      {
        "code": "deck_compatible",
        "value": true
      },
      {
        "code": "deck_shape",
        "value": [
          "rectangular",
          "l_shaped"
        ]
      },
      {
        "code": "deck_material_type",
        "value": "wood"
      },
      {
        "code": "store_velocity_category",
        "value": "high"
      },
      {
        "code": "recommended_restock_quantity",
        "value": 100
      },
      {
        "code": "typical_days_supply",
        "value": 7
      },
      {
        "code": "restock_priority",
        "value": "high"
      }
    ],
    "routes": [
      {
        "categoryId": "cat_002",
        "position": 64
      },
      {
        "categoryId": "cat_007",
        "position": 100
      }
    ]
  },
  {
    "sku": "LBR-2EBB314A",
    "type": "simple",
    "name": "SafeGuard 2x6 Stud - 8ft",
    "status": "enabled",
    "visibility": "both",
    "price": 15.175584317732408,
    "attributes": [
      {
        "code": "product_category",
        "value": "structural_materials"
      },
      {
        "code": "brand",
        "value": "proframe"
      },
      {
        "code": "unit_of_measure",
        "value": "EA"
      },
      {
        "code": "project_types",
        "value": [
          "new_construction",
          "remodel",
          "repair"
        ]
      },
      {
        "code": "ppe_cut_resistance",
        "value": "a8"
      },
      {
        "code": "lumber_treatment",
        "value": "pressure_treated_aca"
      },
      {
        "code": "ppe_category",
        "value": "hearing_protection"
      },
      {
        "code": "drywall_edge_type",
        "value": "square"
      },
      {
        "code": "ppe_niosh_rating",
        "value": "p100"
      },
      {
        "code": "construction_phase",
        "value": [
          "foundation_framing"
        ]
      },
      {
        "code": "quality_tier",
        "value": "professional"
      },
      {
        "code": "deck_compatible",
        "value": true
      },
      {
        "code": "deck_shape",
        "value": [
          "rectangular",
          "l_shaped"
        ]
      },
      {
        "code": "deck_material_type",
        "value": "wood"
      },
      {
        "code": "store_velocity_category",
        "value": "high"
      },
      {
        "code": "recommended_restock_quantity",
        "value": 75
      },
      {
        "code": "typical_days_supply",
        "value": 7
      },
      {
        "code": "restock_priority",
        "value": "high"
      }
    ],
    "routes": [
      {
        "categoryId": "cat_002",
        "position": 20
      },
      {
        "categoryId": "cat_007",
        "position": 58
      }
    ]
  },
  {
    "sku": "LBR-26852468",
    "type": "simple",
    "name": "FastenPro 2x8 Joist - 10ft",
    "status": "enabled",
    "visibility": "both",
    "price": 20.5719330322798,
    "attributes": [
      {
        "code": "product_category",
        "value": "structural_materials"
      },
      {
        "code": "brand",
        "value": "structuremaster"
      },
      {
        "code": "unit_of_measure",
        "value": "EA"
      },
      {
        "code": "project_types",
        "value": [
          "new_construction",
          "remodel",
          "repair"
        ]
      },
      {
        "code": "door_core_type",
        "value": "foam_core"
      },
      {
        "code": "door_material",
        "value": "vinyl"
      },
      {
        "code": "drywall_product_type",
        "value": "mold_resistant"
      },
      {
        "code": "construction_phase",
        "value": [
          "foundation_framing"
        ]
      },
      {
        "code": "quality_tier",
        "value": "professional"
      },
      {
        "code": "deck_compatible",
        "value": true
      },
      {
        "code": "deck_shape",
        "value": [
          "rectangular",
          "l_shaped"
        ]
      },
      {
        "code": "deck_material_type",
        "value": "wood"
      },
      {
        "code": "store_velocity_category",
        "value": "medium"
      },
      {
        "code": "recommended_restock_quantity",
        "value": 50
      },
      {
        "code": "typical_days_supply",
        "value": 14
      },
      {
        "code": "restock_priority",
        "value": "medium"
      }
    ],
    "routes": [
      {
        "categoryId": "cat_002",
        "position": 82
      },
      {
        "categoryId": "cat_007",
        "position": 18
      }
    ]
  },
  {
    "sku": "LBR-2D637246",
    "type": "simple",
    "name": "PremiumBuild 2x10 Joist - 12ft",
    "status": "enabled",
    "visibility": "both",
    "price": 30.551493647765135,
    "attributes": [
      {
        "code": "product_category",
        "value": "structural_materials"
      },
      {
        "code": "brand",
        "value": "premiumbuild"
      },
      {
        "code": "unit_of_measure",
        "value": "EA"
      },
      {
        "code": "project_types",
        "value": [
          "new_construction",
          "remodel"
        ]
      },
      {
        "code": "fastener_material",
        "value": "steel"
      },
      {
        "code": "fastener_drive_type",
        "value": "torx"
      },
      {
        "code": "construction_phase",
        "value": [
          "foundation_framing"
        ]
      },
      {
        "code": "quality_tier",
        "value": "professional"
      },
      {
        "code": "deck_compatible",
        "value": true
      },
      {
        "code": "deck_shape",
        "value": [
          "rectangular",
          "l_shaped"
        ]
      },
      {
        "code": "deck_material_type",
        "value": "wood"
      },
      {
        "code": "store_velocity_category",
        "value": "medium"
      },
      {
        "code": "recommended_restock_quantity",
        "value": 40
      },
      {
        "code": "typical_days_supply",
        "value": 14
      },
      {
        "code": "restock_priority",
        "value": "medium"
      }
    ],
    "routes": [
      {
        "categoryId": "cat_002",
        "position": 31
      },
      {
        "categoryId": "cat_007",
        "position": 54
      }
    ]
  },
  {
    "sku": "LBR-96F409FB",
    "type": "simple",
    "name": "ToughGrip 2x12 Beam - 16ft",
    "status": "enabled",
    "visibility": "both",
    "price": 39.04969740055953,
    "attributes": [
      {
        "code": "product_category",
        "value": "structural_materials"
      },
      {
        "code": "brand",
        "value": "fastenpro"
      },
      {
        "code": "unit_of_measure",
        "value": "EA"
      },
      {
        "code": "project_types",
        "value": [
          "new_construction",
          "remodel"
        ]
      },
      {
        "code": "drywall_fire_rating",
        "value": "non_rated"
      },
      {
        "code": "fastener_head_type",
        "value": "flat"
      },
      {
        "code": "construction_phase",
        "value": [
          "foundation_framing"
        ]
      },
      {
        "code": "quality_tier",
        "value": "premium"
      },
      {
        "code": "deck_compatible",
        "value": false
      },
      {
        "code": "store_velocity_category",
        "value": "low"
      },
      {
        "code": "recommended_restock_quantity",
        "value": 20
      },
      {
        "code": "typical_days_supply",
        "value": 30
      },
      {
        "code": "restock_priority",
        "value": "low"
      }
    ],
    "routes": [
      {
        "categoryId": "cat_002",
        "position": 39
      },
      {
        "categoryId": "cat_007",
        "position": 41
      }
    ]
  },
  {
    "sku": "LBR-9D32768F",
    "type": "simple",
    "name": "ProFrame 4x4 Post - 8ft",
    "status": "enabled",
    "visibility": "both",
    "price": 30.244575501533493,
    "attributes": [
      {
        "code": "product_category",
        "value": "structural_materials"
      },
      {
        "code": "brand",
        "value": "premiumbuild"
      },
      {
        "code": "unit_of_measure",
        "value": "EA"
      },
      {
        "code": "project_types",
        "value": [
          "new_construction",
          "remodel"
        ]
      },
      {
        "code": "ppe_nrr_rating",
        "value": "30"
      },
      {
        "code": "fastener_drive_type",
        "value": "phillips"
      },
      {
        "code": "fastener_subtype",
        "value": "framing_nail"
      },
      {
        "code": "door_core_type",
        "value": "hollow_core"
      },
      {
        "code": "construction_phase",
        "value": [
          "foundation_framing"
        ]
      },
      {
        "code": "quality_tier",
        "value": "professional"
      },
      {
        "code": "deck_compatible",
        "value": true
      },
      {
        "code": "deck_shape",
        "value": [
          "rectangular",
          "l_shaped"
        ]
      },
      {